"conversation_id_str","created_at","favorite_count","full_text","id_str","image_url","in_reply_to_screen_name","lang","location","quote_count","reply_count","retweet_count","tweet_url","user_id_str","username"
"1798643491649843374","Thu Jun 06 09:10:00 +0000 2024","0","Presiden terpilih Prabowo Subianto merespons polemik program Tabungan Perumahan Rakyat (Tapera). Prabowo memastikan akan mencari solusi terbaik dari permasalahan ini. #Prabowo #Tapera #MedcomId https://t.co/C4KLq4p9pc","1798643491649843374","","","in","Jakarta Capital Region, Indone","0","0","0","https://x.com/medcom_id/status/1798643491649843374","902837643024539651","medcom_id"
"1797221627869946115","Sun Jun 02 11:00:01 +0000 2024","1","Menteri Pariwisata dan Ekonomi Kreatif Sandiaga Uno menolak skema iuran Tabungan Perumahan Rakyat (Tapera). Sandi menolak skema pemotongan gaji untuk Tapera yang dibebankan untuk semua pekerja dan perusahaan. #SandiagaUno #Tapera #MedcomId https://t.co/omgXYuhj3P","1797221627869946115","","","in","Jakarta Capital Region, Indone","0","0","0","https://x.com/medcom_id/status/1797221627869946115","902837643024539651","medcom_id"
"1798311302609146315","Wed Jun 05 11:10:00 +0000 2024","0","Pemerintah menerapkan kebijakan tentang Tabungan Perumahan Rakyat (Tapera). Sebanyak 3 persen dari gaji pekerja di Indonesia akan dipotong setiap bulannya untuk simpanan Tapera. #Tapera #MedcomId https://t.co/nOwpWpo4OS","1798311302609146315","","","in","Jakarta Capital Region, Indone","0","0","0","https://x.com/medcom_id/status/1798311302609146315","902837643024539651","medcom_id"
"1798318852360589450","Wed Jun 05 11:40:00 +0000 2024","0","Peraturan Pemerintah (PP) Nomor 21 Tahun 2024 tentang Perubahan Atas PP Nomor 25 Tahun 2020 tentang Penyelenggaraan Tabungan Perumahan Rakyat (Tapera) banyak dapat penolakan dari lapisan masyarakat. #Buruh #Tapera #MedcomId https://t.co/KxyUcRe6o9","1798318852360589450","","","in","Jakarta Capital Region, Indone","0","0","0","https://x.com/medcom_id/status/1798318852360589450","902837643024539651","medcom_id"
"1797543744956256419","Mon Jun 03 08:20:00 +0000 2024","0","Pemerintah menerapkan program simpanan Tabungan Perumahan Rakyat (Tapera) yang mewajibkan para pekerja membayar iurannya setiap bulan sebesar 3 persen gaji. #Tapera #MedcomId https://t.co/PKlGrmZjdZ","1797543744956256419","","","in","Jakarta Capital Region, Indone","0","0","0","https://x.com/medcom_id/status/1797543744956256419","902837643024539651","medcom_id"
"1797511029481758973","Mon Jun 03 06:10:00 +0000 2024","0","Anggota Komisi V DPR Suryadi Jaya Purnama menilai potongan gaji berlabel wajib membuat trauma pekerja. Terlebih adanya program Tabungan Perumahan Rakyat (Tapera) yang membuat gaji pekerja dipotong sebesar tiga persen. #Tapera #MedcomId https://t.co/RX9ekPG6dZ","1797511029481758973","","","in","Jakarta Capital Region, Indone","0","0","0","https://x.com/medcom_id/status/1797511029481758973","902837643024539651","medcom_id"
"1800429025682472991","Tue Jun 11 07:25:04 +0000 2024","0"," Skema pengelolaan dana #Tapera dilakukan manajer investasi dengan syarat cukup berat yakni harus memiliki portofolio pengelolaan aset (asset under management/AUM) di atas Rp2 5 triliun. Selengkapnya: https://t.co/1SkQbyBaJk","1800429025682472991","","","in","Jakarta, Indonesia","0","0","0","https://x.com/beritaKBR/status/1800429025682472991","124390203","beritaKBR"
"1797883483471163428","Tue Jun 04 06:50:00 +0000 2024","0","Badan Penyelenggara Jaminan Sosial (BPJS) Ketenagakerjaan meyakini kebijakan Tabungan Perumahan Rakyat (Tapera) dapat memberikan kesejahteraan bagi para pekerja. #BPJS #Tapera #MedcomId https://t.co/8Edbzy3X6p","1797883483471163428","","","in","Jakarta Capital Region, Indone","0","0","0","https://x.com/medcom_id/status/1797883483471163428","902837643024539651","medcom_id"
"1797594076596105641","Mon Jun 03 11:40:00 +0000 2024","0","Serikat Pekerja Seluruh Indonesia (SPSI) Kabupaten Malang meminta Pemerintah mengkaji ulang program Tabungan Perumahan Rakyat (Tapera). #SPSI #Tapera #MedcomId https://t.co/0HEsTrb65t","1797594076596105641","","","in","Jakarta Capital Region, Indone","0","0","0","https://x.com/medcom_id/status/1797594076596105641","902837643024539651","medcom_id"
"1800026605244530924","Mon Jun 10 04:46:00 +0000 2024","3","Iuran tambahan ini dirasa akan menjadi beban tambahan bagi pemberi kerja dan pekerja. detikers setuju? #Tapera https://t.co/HRcatkKVbA","1800026605244530924","","","in","","0","0","1","https://x.com/detikcom/status/1800026605244530924","69183155","detikcom"
"1801076764619489469","Thu Jun 13 02:18:57 +0000 2024","0","Tolak Tapera Buruh Batam Sebut Tahapan Penderitaan Rakyat #Tapera #buruh #batam https://t.co/PTeu1l2LdU","1801076764619489469","","","in","Orchad Walk Blok H-1, Batam","0","0","1","https://x.com/BatamPos/status/1801076764619489469","60490875","BatamPos"
"1797897134110552118","Tue Jun 04 07:44:14 +0000 2024","0","BPK menemukan 124.960 peserta Tapera belum menerima pengembalian dana Rp567 45 miliar dan masalah 40.266 kepesertaan pensiun ganda dengan nilai Rp130 25 miliar pada 2020 dan 2021. Selengkapnya: https://t.co/c9FBeQVse5 #tapera https://t.co/ESYPZ4e7wN","1797897134110552118","https://pbs.twimg.com/media/GPNpkOla8AAodQy.jpg","","in","Jakarta","0","1","0","https://x.com/KATADATAcoid/status/1797897134110552118","552523769","KATADATAcoid"
"1798695158919401760","Thu Jun 06 12:35:18 +0000 2024","0"," Pak ini tapera gimana nih pak kalau pekerja swasta yang udah mencicil KPR-nya udah punya warisan sudah punya rumah gak butuh lagi perumahan apakah masih diwajibkan?' Tanya Anggota DPR Irine Yusiana kepada Menteri PUPR Basuki Hadimuljono. #Tapera https://t.co/gu6kGh9FMO","1798695158919401760","","","in","Jakarta, Indonesia","0","0","0","https://x.com/beritaKBR/status/1798695158919401760","124390203","beritaKBR"
"1798672499791786415","Thu Jun 06 11:05:16 +0000 2024","0","Presiden Konfederasi Serikat Pekerja Indonesia (KSPI) Said Iqbal menegaskan bila PP Tapera tak dicabut maka akan ada aksi lebih meluas di seluruh Indonesia. Benarkah peserta #Tapera pasti mendapatkan rumah? #DemoTapera https://t.co/564AK2cxHS","1798672499791786415","","","in","Jakarta, Indonesia","0","0","0","https://x.com/beritaKBR/status/1798672499791786415","124390203","beritaKBR"
"1797969049701277891","Tue Jun 04 12:30:00 +0000 2024","0","Ketua Koordinator Perkulumpulan Honorer K2 Indonesia (PHK2I) Eko Mardiono menyebut gaji guru terutama honorer sangat kecil. Dia khawatir gaji guru bisa habis bila diikutsertakan menjadi peserta Tapera. #PHK21 #Gaji #Guru #Tapera #MedcomId https://t.co/4VUsBcvcc2","1797969049701277891","","","in","Jakarta Capital Region, Indone","0","0","0","https://x.com/medcom_id/status/1797969049701277891","902837643024539651","medcom_id"
"1797523612809019411","Mon Jun 03 07:00:00 +0000 2024","0","Fraksi NasDem mengkritisi rencana pemotongan penghasilan ojek online (ojol) untuk iuran Tabungan Perumahan Rakyat (Tapera). Pasanya sistem kerja ojol bersifat kemitraan atau bukan pegawai kontrak dan tetap. #NasDem #Kritik #Tapera #MedcomId https://t.co/xV8Ejk4PvY","1797523612809019411","","","in","Jakarta Capital Region, Indone","0","0","0","https://x.com/medcom_id/status/1797523612809019411","902837643024539651","medcom_id"
"1800029613793440159","Mon Jun 10 04:57:57 +0000 2024","0","Iuran tambahan ini dirasa akan menjadi beban tambahan bagi pemberi kerja dan pekerja. detikers setuju? #Tapera https://t.co/jQL6UPZsZO","1800029613793440159","","","in","Jakarta, Indonesia","0","0","0","https://x.com/detikfinance/status/1800029613793440159","135795460","detikfinance"
"1799633777909719237","Sun Jun 09 02:45:02 +0000 2024","0","Bukan Sekarang Iuran Tapera Baru Dimulai Tahun 2027 https://t.co/UMbcDqnzAM #Tapera","1799633777909719237","","","in","Jakarta, Indonesia","0","1","1","https://x.com/KontanNews/status/1799633777909719237","43799886","KontanNews"
"1800226257235284406","Mon Jun 10 17:59:20 +0000 2024","0","14:59:20 #auxílios_apoios local: rua coronel gervasio Interior #Tapera - vítima","1800226257235284406","","","pt","RS","0","0","0","https://x.com/cbmrs193/status/1800226257235284406","1057737869744373768","cbmrs193"
