"conversation_id_str","created_at","favorite_count","full_text","id_str","image_url","in_reply_to_screen_name","lang","location","quote_count","reply_count","retweet_count","tweet_url","user_id_str","username"
"1798744524879237262","Thu Jun 06 15:51:28 +0000 2024","5","#tapera https://t.co/5XcMTE5Ytz","1798744524879237262","https://pbs.twimg.com/ext_tw_video_thumb/1798744479501025281/pu/img/Z1_aP34DEogGhd5N.jpg","","qme","Indonesia ","0","0","5","https://x.com/Apin_PD/status/1798744524879237262","1676940146699272192","Apin_PD"
"1799337850913394875","Sat Jun 08 07:09:08 +0000 2024","3","Easy money #tapera https://t.co/lRlL8ycF3Y","1799337850913394875","https://pbs.twimg.com/media/GPiIPVVaEAAooFL.jpg","","en","Republic of Wakanda","0","0","0","https://x.com/taperamazing/status/1799337850913394875","1758747084348596224","taperamazing"
"1801431802424484293","Fri Jun 14 01:49:45 +0000 2024","1","Ada yg lebih penting dari #Tapera yaitu #TakPadangMakaTakSayang semoga bahagia di akhir pekan bunda semua @nakamoren @geumpiy @fuckgorosei https://t.co/p9vo9hkQ5W","1801431802424484293","https://pbs.twimg.com/media/GP_4rHDbEAIj5S7.jpg","","in","Jakarta Capital Region","0","1","1","https://x.com/rodsmeo/status/1801431802424484293","1519545110635053056","rodsmeo"
"1801119808508858578","Thu Jun 13 09:13:06 +0000 2024","5","@democrazymedia Yang Mulia Pinokio: Kalian itu lho Kok percaya omongan saya. Yo Ndak Tahu Kok Tanya Saya . #Tapera https://t.co/PvCyTBDjJM","1801180987004781005","https://pbs.twimg.com/media/GP8Uj-TaIAAlxUm.jpg","democrazymedia","in","Metaverse","0","0","1","https://x.com/DataZakee/status/1801180987004781005","1490895533611053060","DataZakee"
"1798977795886072257","Fri Jun 07 07:18:24 +0000 2024","2","Basuki mengatakan penerapannya iuran Tapera diundur hingga tahun 2027 dalam rangka membangun kredibilitas. Namun Tapera masih akan tetap berlaku karena merupakan putusan Undang-Undang Nomor 4 Tahun 2016. #tapera #dpr #mpr #basuki https://t.co/5t5FpNfotA","1798977795886072257","https://pbs.twimg.com/amplify_video_thumb/1798977674326777856/img/g6lcPJgXVrtI-voj.jpg","","in","Jakarta, Indonesia","0","2","0","https://x.com/republikaonline/status/1798977795886072257","22126902","republikaonline"
"1797229461701853576","Sun Jun 02 11:31:09 +0000 2024","104","Pemerintah ingin mengarahkan pengeluaran masyarakat untuk hal-hal yang bersifat produktif dengan adanya Tapera. #MetroTVKontroversi #tapera #iurantapera #tabunganperumahanrakyat https://t.co/v0MWQmztS5","1797229461701853576","https://pbs.twimg.com/media/GPEKqq1aAAAEACu.jpg","","in","","617","602","46","https://x.com/Metro_TV/status/1797229461701853576","57261519","Metro_TV"
"1798712594829877364","Thu Jun 06 13:44:35 +0000 2024","2","Jadi VTUBER ikutan di poton tapera juga ? #vtuber #tapera . https://t.co/lcEGaqC7Vs","1798712594829877364","https://pbs.twimg.com/media/GPZPkmfbIAAsp81.jpg","","in","","0","0","0","https://x.com/narukami_shiro/status/1798712594829877364","1641757716086661120","narukami_shiro"
"1798795982181896679","Thu Jun 06 19:15:56 +0000 2024","5","Ada apa mas Mentri? #kemendikbud #mentri #pendidikan #tapera #ukt https://t.co/sHKKhdhXu6","1798795982181896679","https://pbs.twimg.com/ext_tw_video_thumb/1798795944412237827/pu/img/EnBPGw9bKPMpXkLF.jpg","","in","Semarang Barat, Indonesia","0","1","1","https://x.com/UpdateNegri/status/1798795982181896679","1686293980101967872","UpdateNegri"
"1797544368624300493","Mon Jun 03 08:22:28 +0000 2024","7","Tapera Ditolak Pengusaha-Pekerja Pemerintah Lanjut Terus ~N #Tapera https://t.co/T4ylEOb9Ku","1797544368624300493","https://pbs.twimg.com/media/GPIo-e8boAEkrK5.jpg","","in","Jakarta","2","5","2","https://x.com/kompascom/status/1797544368624300493","23343960","kompascom"
"1798886308019839359","Fri Jun 07 01:14:52 +0000 2024","4","Arep Tape Ra? (Asal usul #Tapera ) https://t.co/uQPq9CYFzt","1798886308019839359","https://pbs.twimg.com/media/GPbtYFoacAAqh7-.png","","in","Malang","0","3","1","https://x.com/nurudinwriter/status/1798886308019839359","158335725","nurudinwriter"
"1798564672100307058","Thu Jun 06 03:56:48 +0000 2024","31","Ngakak sendiri ngeditnya.. Terutama di detik ke-28 mirip opening anime banget... Cuman ada opening animenya tapi episodenya bisa ditonton di kehidupan real masing-masing... #tapera https://t.co/ZSgRpgTQ02","1798564672100307058","https://pbs.twimg.com/ext_tw_video_thumb/1798563518788362241/pu/img/RegM5_9nOE4ggB3f.jpg","","in","Jakarta","10","0","21","https://x.com/BraveVoyagers/status/1798564672100307058","2164162200","BraveVoyagers"
"1798986180975067309","Fri Jun 07 07:51:43 +0000 2024","0","Menteri Pekerjaan Umum dan Perumahan Rakyat (PUPR) Basuki Hadimuljono mengakui bahwa salah satu faktor yang membuat Tapera masih menjadi polemik dan memicu kemarahan publik dikarenakan sosialisasi pemerintah masih lemah. | #Tapera https://t.co/6vYnA1ZGpn","1798986180975067309","https://pbs.twimg.com/media/GPdIJlhbQAAT4TP.jpg","","in","Jakarta","1","0","0","https://x.com/kompascom/status/1798986180975067309","23343960","kompascom"
"1798240640930873583","Wed Jun 05 06:29:13 +0000 2024","942","Mengapa masyarakat sulit punya rumah? Sawah? Kebun? Tanah? Ditambah gaji dipotong untuk #Tapera. Di sisi lain. Jutaan hektar tanah dikuasai oleh perusahaan. Pemberian konsesi penebangan hutan dan pembukaan tambang sangat mudah. Ormas keagamaan dapat jatah #tambang. https://t.co/SdKwgFp4C6","1798240640930873583","https://pbs.twimg.com/ext_tw_video_thumb/1798240516955688960/pu/img/Glf0O5tXeIoibqj6.jpg","","in","Jakarta Capital Region","10","3","398","https://x.com/watchdoc_ID/status/1798240640930873583","2959310304","watchdoc_ID"
"1799031192483995752","Fri Jun 07 10:50:35 +0000 2024","4","Belakangan ini masyarakat dihujani berbagai kebijakan yang kontroversial seperti iuran Tapera UKT naik dll. Apakah ini sebuah pengalihan isu? #MetroTVKontroversi #jokowidodo #putusanMA #tapera #UKTNaik #pilkada2024 https://t.co/X9hYifFE36","1799031192483995752","https://pbs.twimg.com/media/GPdxVeua8AAmhcs.jpg","","in","","0","7","2","https://x.com/Metro_TV/status/1799031192483995752","57261519","Metro_TV"
"1798543506996346904","Thu Jun 06 02:32:42 +0000 2024","1","Tapera tuai polemik Demokrat tampung keluhan masyarakat. #ahy #demokrat #tapera https://t.co/SM6MKuatDe","1798543506996346904","https://pbs.twimg.com/ext_tw_video_thumb/1798543416403591168/pu/img/ijQ2rXevgfr45h6J.jpg","","in","","0","0","0","https://x.com/Demokrat_TV/status/1798543506996346904","284830933","Demokrat_TV"
"1798713690042274164","Thu Jun 06 13:48:56 +0000 2024","2","Sdh gembira eeeh malah di tunda.. #tapera https://t.co/eGE23DK4qV","1798713690042274164","https://pbs.twimg.com/media/GPZQkYuacAABvrz.jpg","","in","DKI Jakarta, Indonesia","0","0","0","https://x.com/Javeed_Lelete/status/1798713690042274164","1484395052705415170","Javeed_Lelete"
"1800240715311800385","Mon Jun 10 18:56:48 +0000 2024","5","Mari bersiap! TOLAK PP TAPERA! #tapera #tolakpptapera #cabutpptapera #bicaralahburuh #suarakaumburuh https://t.co/okFeJkUAki","1800240715311800385","https://pbs.twimg.com/media/GPu9YgobUAA3YmN.jpg","","in","Kota Batam, Kepulauan Riau","0","0","1","https://x.com/puksanwabatam/status/1800240715311800385","963442792901918722","puksanwabatam"
"1800006229479334137","Mon Jun 10 03:25:02 +0000 2024","6","Menteri PUPR Basuki Hadimuljono menanggapi respons negatif masyarakat terhadap Program Tapera. Basuki yang juga menjabat Ketua Komite BP Tapera mengaku menyesal karena program itu membuat marah masyarakat.⁣ &gt;&gt; https://t.co/7B16o6eFQ8 #detikfinance #Tapera #BasukiHadimuljono https://t.co/0d0PfNZXE8","1800006229479334137","https://pbs.twimg.com/media/GProHTaagAAVjyg.jpg","","in","Jakarta, Indonesia","0","0","3","https://x.com/detikfinance/status/1800006229479334137","135795460","detikfinance"
"1798670834015625360","Thu Jun 06 10:58:39 +0000 2024","4","𝐒𝐞𝐬𝐮𝐬𝐚𝐡 𝐈𝐭𝐮k𝐚𝐡 𝐌𝐚𝐬𝐲𝐚𝐫𝐚𝐤𝐚𝐭 𝐊𝐢𝐭𝐚 𝐏𝐮𝐧𝐲𝐚 𝐑𝐮𝐦𝐚𝐡? - Podcast TeKo (Teliti Ekonomi) Eps 3 𝘀𝘂𝗱𝗮𝗵 𝘁𝗮𝘆𝗮𝗻𝗴. Mari menonton! https://t.co/HQ7lmt6tod #lpemfebui #febui #universitasindonesia #perumahan #tapera #asianvalue https://t.co/uSkoXUiPEK","1798670834015625360","https://pbs.twimg.com/ext_tw_video_thumb/1798669427698974720/pu/img/8ulN3utvk9jziTzM.jpg","","in","Jakarta, Indonesia","0","0","1","https://x.com/LPEMFEBUI/status/1798670834015625360","1569883093","LPEMFEBUI"
"1796912619804102735","Sat Jun 01 14:32:08 +0000 2024","11","Kepala Staf Kepresidenan Moeldoko menyatakan Tabungan Perumahan rakyat (Tapera) bukan potong gaji atau iuran melainkan tabungan. Pekerja yang sudah mempunyai rumah disebut bisa mencairkannya ketika sudah pensiun. #tapera #iurantapera #pensiun https://t.co/Yr94TTuaZI","1796912619804102735","https://pbs.twimg.com/media/GO_qf7dXkAASznZ.jpg","","in","","4","37","2","https://x.com/detikcom/status/1796912619804102735","69183155","detikcom"
"1797542577933320522","Mon Jun 03 08:15:21 +0000 2024","2","Buat para ojol siap-siap ya dengan Tapera. Meski masih dipelajari tapi persiapkan diri dulu aja. Btw gimana nih tanggapan kalian dengan Tapera? #detikSumut #Tapera #Ojol #OjekOnline https://t.co/n9pVPu3Eo7","1797542577933320522","https://pbs.twimg.com/ext_tw_video_thumb/1797541839127687168/pu/img/N5EaAxX6Jr4bZoe7.jpg","","in","","0","1","1","https://x.com/detiksumut_/status/1797542577933320522","1613441633735020545","detiksumut_"
"1800672444543643680","Tue Jun 11 23:32:20 +0000 2024","42"," Saya memahami beban-beban yang ada dan oleh karena itu APBN ingin kurangi beban masyarakat melalui berbagai cara dari sisi perumahan kata Menteri Keuangan Sri Mulyani. | #SriMulyani #Tapera https://t.co/UU02p9dxbh","1800672444543643680","https://pbs.twimg.com/media/GP1F2gxbQAAg17g.jpg","","in","Jakarta","8","94","22","https://x.com/kompascom/status/1800672444543643680","23343960","kompascom"
"1798914985076342841","Fri Jun 07 03:08:49 +0000 2024","3","Presiden terpilih Prabowo Subianto mengatakan Program TAPERA masih bisa dikaji lebih lanjut dan dicarikan solusi yang terbaik. Saat ditanya wartawan apakah TAPERA akan dijalankan di masa pemerintahannya Prabowo tidak menjawab pertanyaan wartawan. #prabowo #tapera https://t.co/lm7fk3ZzUL","1798914985076342841","https://pbs.twimg.com/media/GPcHbR_aEAAD_at.jpg","","in","","1","1","0","https://x.com/Metro_TV/status/1798914985076342841","57261519","Metro_TV"
"1799047261386916266","Fri Jun 07 11:54:26 +0000 2024","3","PSI menilai tidak ada yang dalam proses hukum di MA soal batas usia calon kepala daerah dan mempertanyakan mengapa baru ribut setelah diputuskan. #MetroTVKontroversi #jokowidodo #putusanMA #tapera #UKTNaik #pilkada2024 https://t.co/1HaRzuu4C1","1799047261386916266","https://pbs.twimg.com/media/GPd_8f-aIAA_ggL.jpg","","in","","2","5","0","https://x.com/Metro_TV/status/1799047261386916266","57261519","Metro_TV"
"1799029882393178419","Fri Jun 07 10:45:23 +0000 2024","2","Saksikan #HotroomMetroTV episode Tapera Bikin Sengsara di https://t.co/oUoL7q8nmp #tapera #rumah #tabungan #tabunganrumah #gajikaryawan https://t.co/ndH7CDIgRS","1799029884964294809","https://pbs.twimg.com/ext_tw_video_thumb/1799029783243997184/pu/img/4T2oA1ECxfbEI6xU.jpg","Metro_TV","in","","0","0","0","https://x.com/Metro_TV/status/1799029884964294809","57261519","Metro_TV"
"1798890416760340876","Fri Jun 07 01:31:11 +0000 2024","25","Menteri Pekerjaan Umum dan Perumahan Rakyat (PUPR) Basuki Hadimuljono tak menyangka dan menyesal ternyata publik begitu marah atas program Tabungan Perumahan Rakyat (Tapera) yang disiapkan pemerintah. | #Tapera https://t.co/G4Lx9GMe5B","1798890416760340876","https://pbs.twimg.com/media/GPbxQPAbEAEOkgx.jpg","","in","Jakarta","14","37","11","https://x.com/kompascom/status/1798890416760340876","23343960","kompascom"
"1798971991157842033","Fri Jun 07 06:55:20 +0000 2024","1","Ekonom Senior INDEF Aviliani sebut penghasilan masyarakat Indonesia menjadi salah satu faktor Tapera belum bisa dilaksanakan di Indonesia. #tapera #rumah #tabungan #tabunganrumah #gajikaryawan https://t.co/oO3fcvyaSd","1798971991157842033","https://pbs.twimg.com/media/GPc7dm8b0AEKA9K.jpg","","in","","0","1","0","https://x.com/Metro_TV/status/1798971991157842033","57261519","Metro_TV"
"1799087722503750056","Fri Jun 07 14:35:13 +0000 2024","3","Dengan adanya kebijakan-kebijakan yang kontroversial dan tidak merakyat di ujung pemerintahan Jokowi apakah akan menjadi beban untuk pemerintahan Prabowo-Gibran? #MetroTVKontroversi #jokowidodo #putusanMA #tapera #UKTNaik #pilkada2024 https://t.co/pICAiq5gIH","1799087722503750056","https://pbs.twimg.com/media/GPekvmgbAAAwVdi.jpg","","in","","1","2","3","https://x.com/Metro_TV/status/1799087722503750056","57261519","Metro_TV"
"1800751307944567280","Wed Jun 12 04:45:42 +0000 2024","6","Buruh Batam menolak PP #tapera https://t.co/IIjxHCokNb","1800751307944567280","https://pbs.twimg.com/ext_tw_video_thumb/1800751250432241664/pu/img/5V2pEc5zTF9JMfkJ.jpg","","in","Kota Batam, Kepulauan Riau","0","0","0","https://x.com/minto_milanisti/status/1800751307944567280","4731465590","minto_milanisti"
"1799088391625355487","Fri Jun 07 14:37:52 +0000 2024","3","Jika kebijakan kontroversial seperti Tapera dan kenaikan UKT muncul sebelum Pilpres apakah masyarakat akan tetap memilih keberlanjutan? #MetroTVKontroversi #jokowidodo #putusanMA #tapera #UKTNaik #pilkada2024 https://t.co/4sebStPyB6","1799088391625355487","https://pbs.twimg.com/media/GPelWgoasAA5yhS.jpg","","in","","1","3","4","https://x.com/Metro_TV/status/1799088391625355487","57261519","Metro_TV"
"1795810852391846368","Wed May 29 13:34:06 +0000 2024","7545","Putri (bukan nama sebenarnya) seorang pensiunan guru PNS peserta program tabungan perumahan yang waktu itu namanya Bapertarum hanya mendapat pencairan Rp 6 6 juta dari periode kepesertaannya selama 28 tahun. #focus #tapera #bisnis #videonews https://t.co/OfNzXiFwnU https://t.co/1xIQrdBFKH","1795810852391846368","https://pbs.twimg.com/amplify_video_thumb/1795810767222214656/img/3KNrhZUedgja5dkt.jpg","","in","","714","813","3924","https://x.com/kumparan/status/1795810852391846368","759692754985242625","kumparan"
"1797884868153782394","Tue Jun 04 06:55:30 +0000 2024","11","Bisa jadi hp kedua atau hp rahasia. Mungil banget! Link Shopee :https://t.co/hvPEFNx6jO #Tapera #pepaya https://t.co/Wi52EUOmC5","1797884868153782394","https://pbs.twimg.com/ext_tw_video_thumb/1775748522106920960/pu/img/q0dcZ2BQ1y53OtC2.jpg","","in","Jakarta","0","0","1","https://x.com/allucantwit/status/1797884868153782394","320308766","allucantwit"
"1798730220478050763","Thu Jun 06 14:54:38 +0000 2024","0","Presiden terpilih Prabowo Subianto mengatakan Program TAPERA masih bisa dikaji lebih lanjut dan dicarikan solusi yang terbaik. #prabowo #tapera #presidenindonesia #prabowosubianto https://t.co/ZjjRJNYg1C","1798730220478050763","https://pbs.twimg.com/media/GPZexR9a8AAbSW0.png","","in","","0","2","1","https://x.com/Metro_TV/status/1798730220478050763","57261519","Metro_TV"
"1800751043208474841","Wed Jun 12 04:44:39 +0000 2024","6","Aksi unjuk rasa buruh kota Batam hari ini #tolakpptapera #tapera #cabutpptapera #suarakaumburuh https://t.co/iVgUrc4LAb","1800751043208474841","https://pbs.twimg.com/ext_tw_video_thumb/1800750983498354688/pu/img/YLe6n1TwMK-ZNkwa.jpg","","in","Kota Batam, Kepulauan Riau","0","0","1","https://x.com/puksanwabatam/status/1800751043208474841","963442792901918722","puksanwabatam"
"1798958078018326841","Fri Jun 07 06:00:03 +0000 2024","17","PDIP menjelaskan alasan menolak UU Tapera meski dulu menjadi salah satu partai pendukung. #detikcom #Tapera https://t.co/KCCa5FiUQD","1798958078018326841","https://pbs.twimg.com/ext_tw_video_thumb/1798897392751964160/pu/img/JEF2HzGY5P5P27Ta.jpg","","in","","1","10","6","https://x.com/detikcom/status/1798958078018326841","69183155","detikcom"
"1799084423973130594","Fri Jun 07 14:22:06 +0000 2024","2","prabowoingin rakyatmakmur #prabowogibran2024 #presidenindonesia #indonesiatranding #IndonesiaEmas #tapera https://t.co/PsNK6bnnDi","1799084423973130594","https://pbs.twimg.com/media/GPehvpfbAAE6GHE.jpg","","in","","0","0","0","https://x.com/PapuaB78208/status/1799084423973130594","1787278945521647616","PapuaB78208"
"1798684336809738697","Thu Jun 06 11:52:18 +0000 2024","7","Peraturan Pemerintah (PP) Tabungan Perumahan Rakyat (Tapera) yang belakangan di tetapkan oleh pemerintah jadi mimpi buruk bagi para kelas pekerja dan pengusaha. #BandungBergerak #BerceritadariPinggir #Tapera #PPTaperan #Pekerja #Pengusaha https://t.co/c93WdxANf9 https://t.co/82VKzeSlTA","1798684336809738697","https://pbs.twimg.com/ext_tw_video_thumb/1798684272250986496/pu/img/BFtiZlU3ShQDA5cI.jpg","","in","Bandung","0","1","2","https://x.com/BdgBergerakID/status/1798684336809738697","1493801169075855365","BdgBergerakID"
"1799044416235319448","Fri Jun 07 11:43:08 +0000 2024","2","Mengapa batas usia calon kepala daerah baru diubah sekarang? Apakah memang untuk semua orang atau hanya orang-orang tertentu? #MetroTVKontroversi #jokowidodo #putusanMA #tapera #UKTNaik #pilkada2024 https://t.co/MAUQpBowKd","1799044416235319448","https://pbs.twimg.com/media/GPd9W4SbEAAbobo.jpg","","in","","0","2","1","https://x.com/Metro_TV/status/1799044416235319448","57261519","Metro_TV"
"1798278593446817899","Wed Jun 05 09:00:01 +0000 2024","1","Rencana pemerintah memotong gaji pegawai 2 5% Tapera tuai penolakan masyarakat kelas menengah yg terhimpit berbagai tagihan bulanan akan semakin terjepit. BEL Selengkapnya: https://t.co/FuyVqGu34x #SeputariNewsSiang #karyawanswasta #tapera https://t.co/sfgbVEJ9AZ","1798278593446817899","https://pbs.twimg.com/media/GPS3HIiawAEZ-iJ.jpg","","in","iNews Tower Jakarta","0","1","1","https://x.com/SeputariNews/status/1798278593446817899","375995332","SeputariNews"
"1801189102848790864","Thu Jun 13 09:45:21 +0000 2024","0","Gimana nih menurutmu? Worth it ga? Mimin pantau kayanya banyak yang hitung-menghitung simulasi tabungan Tapera nih. Kalau infografik yang satu ini hitungan versi tim peneliti LPEM FEB UI ya. Yuk simak! #lpem #universitasindonesia #FEBUI #tapera #perumahan https://t.co/Oyr1cyZOon","1801189102848790864","https://pbs.twimg.com/ext_tw_video_thumb/1801188491210133504/pu/img/3wuZMzaCf97aRDdZ.jpg","","in","Jakarta, Indonesia","0","1","0","https://x.com/LPEMFEBUI/status/1801189102848790864","1569883093","LPEMFEBUI"
"1798954539040514527","Fri Jun 07 05:45:59 +0000 2024","6","Pembahasan mengenai tapera hingga saat ini masih menjadi topik pembicaraan 'hangat' di kalangan masyarakat maupun pemerintahan. Karena kebijakan tapera banyak menuai kritik dan penolakan dari masyarakat. #Basukihadimuljono #PUPR #Tapera #DPR #KomisiV #PRMN https://t.co/mXttjxIKWS","1798954539040514527","https://pbs.twimg.com/ext_tw_video_thumb/1798954477426466816/pu/img/JkqaJN1gcQO-avFY.jpg","","in","Indonesia","1","1","1","https://x.com/pikiran_rakyat/status/1798954539040514527","58880688","pikiran_rakyat"
"1797477161181556754","Mon Jun 03 03:55:25 +0000 2024","6","Kepala Staf Kepresidenan Moeldoko pastikan program Tapera tak ada hubungannya dengan Anggaran Pendapatan dan Belanja Negara (APBN). Tabungan para pekerja yang berpenghasilan rendah itu menurutnya tidak akan dimasukkan ke kas negara. #TempoHeadliner #Tapera https://t.co/Y8AykzNt1N","1797477161181556754","https://pbs.twimg.com/media/GPHrVsLa4AEmphH.jpg","","in","Indonesia","11","50","5","https://x.com/tempodotco/status/1797477161181556754","18129942","tempodotco"
"1797229461701853576","Sun Jun 02 11:31:42 +0000 2024","53","Saksikan #MetroTVKontroversi TAPERA GAJI KIAN TIPIS BIKIN MIRIS selengkapnya di https://t.co/FCBcqvUQLv #tapera #iurantapera #tabunganperumahanrakyat https://t.co/I5NhVOmkeV","1797229599660867929","https://pbs.twimg.com/ext_tw_video_thumb/1797229535630589952/pu/img/6hAlQUJh3Zan2FNn.jpg","Metro_TV","in","","638","205","26","https://x.com/Metro_TV/status/1797229599660867929","57261519","Metro_TV"
"1798580579270869195","Thu Jun 06 05:00:00 +0000 2024","2","Wakil Ketua Umum Gelora Fahri Hamzah mengkritik kebijakan gaji pekerja yang akan dipotong untuk Tabungan Perumahan Rakyat (Tapera). #detikcom #FahriHamzah #Tapera https://t.co/BjAHnPoav0","1798580579270869195","https://pbs.twimg.com/ext_tw_video_thumb/1798552911343214593/pu/img/ShzM4_Urb4kK_9pL.jpg","","in","","1","1","2","https://x.com/detikcom/status/1798580579270869195","69183155","detikcom"
"1798876649276211565","Fri Jun 07 00:36:29 +0000 2024","12","Menteri PUPR Basuki Hadimuljono dicecar terkait Tapera saat Rapat Kerja dengan anggota Komisi V DPR RI. Program Tapera ini dianggap sama-sama ditolak oleh pemberi pekerja dan pekerja sendiri. | #Tapera https://t.co/famqg2YqkY","1798876649276211565","https://pbs.twimg.com/media/GPbkszMaoAARKmQ.jpg","","in","Jakarta","0","1","3","https://x.com/kompascom/status/1798876649276211565","23343960","kompascom"
"1800751492376522938","Wed Jun 12 04:46:26 +0000 2024","7","Buruh Batam menolak PP #tapera https://t.co/r4VKWyv2sW","1800751492376522938","https://pbs.twimg.com/ext_tw_video_thumb/1800751448311181312/pu/img/2lBbTK1fCCFY-mUp.jpg","","in","Kota Batam, Kepulauan Riau","0","1","1","https://x.com/puksanwabatam/status/1800751492376522938","963442792901918722","puksanwabatam"
"1798978989287223683","Fri Jun 07 07:23:09 +0000 2024","5","Jangan sampai memberatkan rakyat Demokrat minta pemerintah kaji kebijakan Tapera secara mendalam. . #demokrat #AHY #pdemokrat #demokratjatim #tapera https://t.co/lAJJZMdnJM","1798978989287223683","https://pbs.twimg.com/media/GPdB22jaMAAOaGI.jpg","","in","","0","0","1","https://x.com/JatimDemokrat/status/1798978989287223683","1359748888014458882","JatimDemokrat"
"1796889477459136882","Sat Jun 01 13:00:10 +0000 2024","8","Komisioner BP Tapera Heru Pudyo Nugroho mengatakan bahwa uang Tabungan Perumahan Rakyat (Tapera) nantinya akan tetap bisa dicairkan bagi semua pekerja yang terdaftar dalam program itu. https://t.co/O1M6NHPb3Z ___ #vivacoid #tapera https://t.co/Fxyk6lw629","1796889477459136882","https://pbs.twimg.com/media/GO_VdQPWoAA4JdK.jpg","","in","","0","25","3","https://x.com/VIVAcoid/status/1796889477459136882","41730943","VIVAcoid"
"1798984812583342406","Fri Jun 07 07:46:17 +0000 2024","5","Wakil Presiden KSPI Riden Hatam Aziz beri penjelasan soal turunnya upah real buruh yang tak bisa menutup angka inflasi begini penjelasannya #tapera #rumah #tabungan #tabunganrumah #gajikaryawan https://t.co/GcLftAzDGf","1798984812583342406","https://pbs.twimg.com/media/GPdHHWLbUAAL-bT.jpg","","in","","0","1","0","https://x.com/Metro_TV/status/1798984812583342406","57261519","Metro_TV"
"1797874811903037672","Tue Jun 04 06:15:32 +0000 2024","1","Kepala Staf Kepresidenan Moeldoko menyatakan program iuran Tapera yang dikelola BP Tapera tidak akan ditunda. Program ini akan tetap berjalan pada 2027. &gt;&gt; https://t.co/U0yjsSxNMz ⁣ #detikfinance #Moeldoko #Tapera https://t.co/FsOwdTny2y","1797874811903037672","https://pbs.twimg.com/media/GPNVksua8AA3B7z.jpg","","in","Jakarta, Indonesia","0","1","0","https://x.com/detikfinance/status/1797874811903037672","135795460","detikfinance"
"1798992084323713489","Fri Jun 07 08:15:11 +0000 2024","2","Program iuran Tabungan Perumahan Rakyat (Tapera) dikritik oleh DPR. Kritik itu lontarkan oleh Irine Yusiana Roba dalam rapat di Gedung DPR Kamis (6/6/2024). Mau tau seperti apa kritikannya? Yuk tonton videonya! #BonusDemografi #IndonesiaEmas2045 #Tapera #DPR https://t.co/Y7PvHdeduw","1798992084323713489","https://pbs.twimg.com/ext_tw_video_thumb/1798990914356158464/pu/img/aIxxwIOi4EGVWffW.jpg","","in","DKI Jakarta","0","1","2","https://x.com/faktacom_/status/1798992084323713489","1664572693180747777","faktacom_"
"1797259568587723255","Sun Jun 02 13:30:47 +0000 2024","2","Menparekraf RI Sandiaga Uno merespons kebijakan Tabungan Perumahan Rakyat (Tapera). Sandi mengatakan kebijakan Tapera harus dilakukan agar generasi muda dapat memiliki rumah. #detikcm #tapera https://t.co/Rll2a4bfQZ","1797259568587723255","https://pbs.twimg.com/ext_tw_video_thumb/1797259530855702528/pu/img/GbhZJThyH-6xezJr.jpg","","in","","0","5","2","https://x.com/detikcom/status/1797259568587723255","69183155","detikcom"
"1797900792256733645","Tue Jun 04 07:58:46 +0000 2024","13","Pel Mini Lipat cuma Rp28.400 Link Shopee https://t.co/KEQ7Yw1r7C #fore #Tapera https://t.co/nrzVtSI0Li","1797900792256733645","https://pbs.twimg.com/ext_tw_video_thumb/1774672101846495232/pu/img/jK6kUAu_Izs0zGfp.jpg","","in","Jakarta","0","0","1","https://x.com/allucantwit/status/1797900792256733645","320308766","allucantwit"
"1796882285385380134","Sat Jun 01 12:31:35 +0000 2024","2","Sudah punya rumah kenapa harus tetap ikut iuran Tapera? Berikut pernyataan dari Komisioner Badan Pengelola (BP) Tapera Heru Pudyo Nugroho. Foto: Muhammad Ridho⁣ ⁣ #tapera #bptapera #iurantapera #pekerja #iuranwajib #subsidikredit https://t.co/Ww0jBh0DGL","1796882285385380134","https://pbs.twimg.com/media/GO_O6AzXgAAoDPW.jpg","","in","","3","7","0","https://x.com/detikcom/status/1796882285385380134","69183155","detikcom"
"1797847428667965457","Tue Jun 04 04:26:44 +0000 2024","13","Sapu Serbaguna Link Shopee :https://t.co/prOK484YWB #Tapera https://t.co/dnL1ulSToP","1797847428667965457","https://pbs.twimg.com/ext_tw_video_thumb/1775056692864229376/pu/img/7yJQXcMEFgo72nYq.jpg","","in","Jakarta","0","0","2","https://x.com/allucantwit/status/1797847428667965457","320308766","allucantwit"
"1798672684055724536","Thu Jun 06 11:06:00 +0000 2024","0","Ribuan buruh berunjuk rasa menolak kebijakan Tapera di kawasan Patung Kuda Jakarta pada Kamis (6/6). Dalam aksi tersebut para buruh membawa sejumlah atribut berupa bendera dan spanduk berisi penolakan. YLD #SeputariNews #RCTI #Tapera #Buruh #UnjukRasa #PatungKuda https://t.co/oNVfy82J2g","1798672684055724536","https://pbs.twimg.com/media/GPYIZ5iaUAE9nLH.jpg","","in","iNews Tower Jakarta","0","0","1","https://x.com/SeputariNews/status/1798672684055724536","375995332","SeputariNews"
