"conversation_id_str","created_at","favorite_count","full_text","id_str","image_url","in_reply_to_screen_name","lang","location","quote_count","reply_count","retweet_count","tweet_url","user_id_str","username"
"1800750802790994349","Wed Jun 12 04:43:42 +0000 2024","7","Aksi unjuk rasa buruh kota Batam hari ini #tolakpptapera #tapera #cabutpptapera #suarakaumburuh https://t.co/QMDlgnUds9","1800750802790994349","https://pbs.twimg.com/ext_tw_video_thumb/1800750739767386113/pu/img/E-TyJQJebAL82D0l.jpg","","in","Kota Batam, Kepulauan Riau","0","0","1","https://x.com/minto_milanisti/status/1800750802790994349","4731465590","minto_milanisti"
"1796776187286438170","Sat Jun 01 05:30:00 +0000 2024","4","Hai SohIB! Menurut data @bps_statistics tentang Proporsi Rumah Tangga dengan Status Kepemilikan #Rumah di Kota dan Desa Indonesia (2018-2023) setidaknya ada 84 79% rumah tangga yg memiliki tempat tinggal sendiri pada 2023 Simak selengkapnya⬇️ #IndonesiaBaik #Perumahan #Tapera https://t.co/x0bq3KP7v8","1796776187286438170","https://pbs.twimg.com/media/GO9bCixawAAjuR9.jpg","","in","Indonesia","0","1","2","https://x.com/IndonesiaBaikId/status/1796776187286438170","831050085534363648","IndonesiaBaikId"
"1797576898501120444","Mon Jun 03 10:31:44 +0000 2024","19","Tapera: Warisan Buruk Jokowi Presiden terpilih Prabowo Subianto sebaiknya tidak melanjutkan program warisan Presiden Joko Widodo yang satu ini: Tabungan Perumahan Rakyat (Tapera). #Tempo #Jokowi #Prabowo #Perumahan #Tapera https://t.co/2nGXYxo8Iy","1797576898501120444","https://pbs.twimg.com/ext_tw_video_thumb/1797575753867091968/pu/img/489rLV_5qZVA_a4m.jpg","","in","","0","4","13","https://x.com/temponewsroom/status/1797576898501120444","88352716","temponewsroom"
"1801207901253435541","Thu Jun 13 11:00:03 +0000 2024","2","𝗦𝗲𝗺𝗼𝗴𝗮 𝗱𝗶𝗯𝗮𝗰𝗮 𝗣𝗲𝗺𝗲𝗿𝗶𝗻𝘁𝗮𝗵 𝗱𝗮𝗻 𝘁𝗲𝗺𝗮𝗻-𝘁𝗲𝗺𝗮𝗻𝗻𝘆𝗮 𝘆𝗮.. Kalau versi kamu rekomendasi kebijakan apalagi yang perlu dilakukan? Baca selengkapnya di sini: https://t.co/cczXjhggDO #lpem #lpemfebui #universitasindonesia #FEBUI #tapera #perumahan https://t.co/I4yq4hI3QW","1801207901253435541","https://pbs.twimg.com/ext_tw_video_thumb/1801193221697196032/pu/img/YHEngzU73KhZfyr_.jpg","","in","Jakarta, Indonesia","0","0","0","https://x.com/LPEMFEBUI/status/1801207901253435541","1569883093","LPEMFEBUI"
"1798189643684524336","Wed Jun 05 03:06:34 +0000 2024","4","Dampak Negatif jika Tapera Lanjut: Pengurangan Tenaga Kerja dan Pendapatan Menurun | #Tapera https://t.co/xLfKBK8Nyw","1798189643684524336","https://pbs.twimg.com/media/GPRz5_ha4AAZDcz.jpg","","in","Jakarta","0","0","1","https://x.com/kompascom/status/1798189643684524336","23343960","kompascom"
"1799033979359932440","Fri Jun 07 11:01:39 +0000 2024","2","Ribuan buruh kelompok pekerja dari KSPI KSPSI KPBI Sendikat Petani Indonesia dan organisasi perempuan percaya melakukan aksi unjuk rasa di Kawasan Patung Kuda Jakarta menolak program tabungan perumahan rakyat atau TAPERA. #Demo #UnjukRasa #Pekerja #Buruh #Tapera https://t.co/lcYCU75oGU","1799033979359932440","https://pbs.twimg.com/ext_tw_video_thumb/1799033897998745600/pu/img/MoabOhLceauvR6BO.jpg","","in","iNews Tower Jakarta","0","1","2","https://x.com/SeputariNews/status/1799033979359932440","375995332","SeputariNews"
"1798593550004912227","Thu Jun 06 05:51:33 +0000 2024","3","Masa buruh akan melakukan aksi demonstrasi menolak program Tabungan Perumahan Rakyat (Tapera) di depan Istana Negara Jakarta hari ini (6/6). Menteri Sekretaris Negara Pratikno mengaku belum tahu ada rencana demonstrasi buruh tersebut. #tapera #demo #demotapera #demoburuh https://t.co/7d7PIy5Zh8","1798593550004912227","https://pbs.twimg.com/media/GPXjJmjaQAAIClT.jpg","","in","","0","2","0","https://x.com/Metro_TV/status/1798593550004912227","57261519","Metro_TV"
"1801125504428528030","Thu Jun 13 05:32:38 +0000 2024","0","Puluhan mahasiswa berunjuk rasa di gedung DPRD Kabupaten Lumajang Jawa Timur. Massa saling dorong dengan polisi lantaran memaksa masuk ke gedung dewan. Mahasiswa menolak peraturan pemerintah terkait Tabungan Perumahan Rakyat. CIL #SeputariNewsRCTI #Tapera #Demo #Lumajang https://t.co/nqtcGtVsoh","1801125504428528030","https://pbs.twimg.com/amplify_video_thumb/1801125339130900481/img/28m9fyhTq2a8XIb7.jpg","","in","iNews Tower Jakarta","0","0","0","https://x.com/SeputariNews/status/1801125504428528030","375995332","SeputariNews"
"1798967982871417308","Fri Jun 07 06:39:24 +0000 2024","1","Apakah pekerja nantinya juga akan mendapatkan bunga dari dana yang didepositokan? #tapera #rumah #tabungan #tabunganrumah #gajikaryawan https://t.co/ajES75LsoB","1798967982871417308","https://pbs.twimg.com/media/GPc3ymNbQAAxbP0.jpg","","in","","0","1","0","https://x.com/Metro_TV/status/1798967982871417308","57261519","Metro_TV"
"1798964359261237620","Fri Jun 07 06:25:01 +0000 2024","1","Simak! Sukur Nababan beri alasan mengapa Tapera perlu ditunda. #tapera #rumah #tabungan #tabunganrumah #gajikaryawan https://t.co/sRJ6q8RlcQ","1798964359261237620","https://pbs.twimg.com/media/GPc0ZBBa8AAvALe.jpg","","in","","0","1","0","https://x.com/Metro_TV/status/1798964359261237620","57261519","Metro_TV"
"1797575468163715484","Mon Jun 03 10:26:03 +0000 2024","1162","Tapera: Warisan Buruk Jokowi Presiden terpilih Prabowo Subianto sebaiknya tidak melanjutkan program warisan Presiden Joko Widodo yang satu ini: Tabungan Perumahan Rakyat (Tapera). #Tempo #Jokowi #Prabowo #Perumahan #Tapera https://t.co/c0JczsPtcS","1797575468163715484","https://pbs.twimg.com/ext_tw_video_thumb/1797574896987652096/pu/img/7uxsUuMxx_86dSeV.jpg","","in","Indonesia","19","46","633","https://x.com/tempodotco/status/1797575468163715484","18129942","tempodotco"
"1799029882393178419","Fri Jun 07 10:45:22 +0000 2024","5","Ada apa sebenarnya dengan pemerintah benarkah yang disebutkan oleh Ahmad Nur Hidayat bahwa negara sedang kesulitan pendanaan? #tapera #rumah #tabungan #tabunganrumah #gajikaryawan https://t.co/LCtHj54Oz6","1799029882393178419","https://pbs.twimg.com/media/GPdwJBYa0AEF5rT.jpg","","in","","0","1","1","https://x.com/Metro_TV/status/1799029882393178419","57261519","Metro_TV"
"1799006990720704659","Fri Jun 07 09:14:25 +0000 2024","0","Indonesia kalah lawan Irak di kualifikasi Piala Dunia 2026 dan kabar populer lainnya #Alinea #Alineadotid #News #PialaDunia2026 #Pildun #Infonesiavsirak #irak #timnasirak #ShinTaeyong #erickthohir #gaza #Newsrecap #Tapera #tni https://t.co/1D20Cf0U9u","1799006990720704659","https://pbs.twimg.com/ext_tw_video_thumb/1799006787775188992/pu/img/blq1ikUuitxLGSMP.jpg","","in","Indonesia","0","0","0","https://x.com/alineadotid/status/1799006990720704659","354168059","alineadotid"
"1797402818229244051","Sun Jun 02 23:00:00 +0000 2024","9","Minta pengelolaan dana akuntabel dan transparan Demokrat sarankan Tapera gandeng Bank Pemerintah. #ahy #demokrat #tapera https://t.co/2D0Yj5a3wJ","1797402818229244051","https://pbs.twimg.com/ext_tw_video_thumb/1797191215684952064/pu/img/b8JjfH8KiNAvlaoI.jpg","","in","","0","2","3","https://x.com/Demokrat_TV/status/1797402818229244051","284830933","Demokrat_TV"
"1799106510934692115","Fri Jun 07 15:49:52 +0000 2024","1","Kepala Staf Kepresidenan Moeldoko menegaskan Tabungan Perumahan Rakyat (Tapera) tidak ditunda tetapi diterapkan tahun 2027. Cuma ditunda aja bukan dibatalkan Jadi gimana menurut kalian ada usulan atau komentar gak nih? #tapera #moeldoko #staffpresiden #jokowi https://t.co/Y8d7Yc5a7P","1799106510934692115","https://pbs.twimg.com/media/GPe11nQbgAAhsvj.jpg","","in","","2","4","3","https://x.com/Metro_TV/status/1799106510934692115","57261519","Metro_TV"
"1797696722430497016","Mon Jun 03 18:27:52 +0000 2024","7","#Tapera @temponewsroom @korantempo https://t.co/4tFsq24EtP","1797696722430497016","https://pbs.twimg.com/ext_tw_video_thumb/1797696685168287744/pu/img/krPLlRvO1KJUAAl5.jpg","","qme","Indonesia","0","0","3","https://x.com/Jelantik5/status/1797696722430497016","2358808668","Jelantik5"
"1797523616135025072","Mon Jun 03 07:00:01 +0000 2024","4","Said Iqbal menyatakan kalangan buruh bakal melakukan aksi besar-besaran menolak kebijakan Tapera dengan turun ke jalan pada hari Kamis 6 Juni 2024 mendatang.⁣ https://t.co/ArxR5vjpr3 #detikcom #Buruh #DemoBuruh #Tapera #IuranTapera #SaidIqbal https://t.co/PiIHLtB60U","1797523616135025072","https://pbs.twimg.com/media/GPIHp8VbEAAenUK.jpg","","in","","0","1","1","https://x.com/detikcom/status/1797523616135025072","69183155","detikcom"
"1796904608935133396","Sat Jun 01 14:00:18 +0000 2024","8","para pekerja yang tercantum menjadi peserta program Tabungan Perumahan Rakyat (Tapera) dan tidak termasuk dalam masyarakat berpenghasilan rendah (MBR) atau sudah memiliki rumah akan disebut sebagai penabung mulia. https://t.co/fpXPeefMtS ___ #vivacoid #tapera https://t.co/9klEb2uEzu","1796904608935133396","https://pbs.twimg.com/media/GO_jN-8WEAAE0Dr.jpg","","in","","2","9","4","https://x.com/VIVAcoid/status/1796904608935133396","41730943","VIVAcoid"
"1799087038358323423","Fri Jun 07 14:32:30 +0000 2024","9","Tapera Sesal Basuki Cecaran DPR dan Permintaan Penundaan! ~N #Tapera #BasukiHadimuljono https://t.co/SLtZ4NwgmG","1799087038358323423","https://pbs.twimg.com/media/GPekD0pasAAfNKi.jpg","","in","Jakarta","1","3","1","https://x.com/kompascom/status/1799087038358323423","23343960","kompascom"
"1798139268797198402","Tue Jun 04 23:46:24 +0000 2024","3776","Rieke Diah Pitaloka meminta BPK melakukan audit menyeluruh terhadap dana Tapera dan biaya operasional BP Tapera tahun 2020 hingga 2023. Hal itu merujuk dari temuan BPK tahun 2021 yang melaporkan ratusan ribu pensiunan belum mendapat pengembalian dana Tapera. | #Tapera https://t.co/a4Di7Cf5vq","1798139268797198402","https://pbs.twimg.com/media/GPRFv0Ma4AAa9rr.jpg","","in","Jakarta","171","226","1355","https://x.com/kompascom/status/1798139268797198402","23343960","kompascom"
"1797863351499833526","Tue Jun 04 05:30:00 +0000 2024","3","BPK menyampaikan laporan terkait temuan adanya 124.960 pensiunan yang belum menerima pengembalian dana Tabungan Perumahan Rakyat (Tapera) dengan nilai total mencapai Rp 567 5 miliar pada 2021 silam. Simak selengkapnya pada visual! https://t.co/DosopFc1lY #detikcom #Tapera https://t.co/B8GNsCAdSe","1797863351499833526","https://pbs.twimg.com/media/GPMcB1dbAAAsxpG.jpg","","in","","0","1","3","https://x.com/detikcom/status/1797863351499833526","69183155","detikcom"
"1798325738313228345","Wed Jun 05 12:07:21 +0000 2024","1","Direktur Jenderal Pembinaan Hubungan Industrial dan Jaminan Sosial Kemnaker Indah Anggoro Putri menjelaskan regulasi tersebut akan dibuat untuk mengatur para pekerja di sektor informal untuk menjadi wajib kepesertaan BP Tapera. IDO #SeputariNewsRcti #Ojol #Tapera #Kemnaker https://t.co/hXmeovX19E","1798325738313228345","https://pbs.twimg.com/media/GPTvrnmbEAEBoMT.jpg","","in","iNews Tower Jakarta","0","0","1","https://x.com/SeputariNews/status/1798325738313228345","375995332","SeputariNews"
"1799031192483995752","Fri Jun 07 10:51:54 +0000 2024","4","Nonton #MetroTVKontroversi HUJAN KEBIJAKAN DI AKHIR MASA JABATAN selengkapnya di https://t.co/ysrkWqfmIg #jokowidodo #putusanMA #tapera #UKTNaik #pilkada2024 https://t.co/twqIVizfvq","1799031524534460496","https://pbs.twimg.com/ext_tw_video_thumb/1799031350596608000/pu/img/gVMGc5XII4xfHOxv.jpg","Metro_TV","in","","0","1","3","https://x.com/Metro_TV/status/1799031524534460496","57261519","Metro_TV"
"1798685140673233302","Thu Jun 06 11:55:30 +0000 2024","0","Komisi V DPR mengatakan pembangunan IKN jangan tergesa gesa dan Basuki Saya Melanjutkan program yang sudah sda dan sementara itu ketika ditanya apakah tuntutan partai buruh soal TAPERA akan menjadi masukan. #TAPERA #TabunganPerumahanRakyat #BasukiHadimuljono #MenteriPUPR https://t.co/gP2iMuuflh","1798685140673233302","https://pbs.twimg.com/media/GPY2i44agAExWGA.png","","in","","0","1","1","https://x.com/Metro_TV/status/1798685140673233302","57261519","Metro_TV"
"1799087722503750056","Fri Jun 07 14:35:42 +0000 2024","1","Nonton #MetroTVKontroversi HUJAN KEBIJAKAN DI AKHIR MASA JABATAN selengkapnya di https://t.co/ysrkWqfmIg #jokowidodo #putusanMA #tapera #UKTNaik #pilkada2024 https://t.co/EOaaLPFgnh","1799087847552803129","https://pbs.twimg.com/ext_tw_video_thumb/1799087789637783552/pu/img/ZJRegFgCmYWMgdsw.jpg","Metro_TV","in","","0","0","2","https://x.com/Metro_TV/status/1799087847552803129","57261519","Metro_TV"
"1799286887393481158","Sat Jun 08 03:46:37 +0000 2024","4","Tribun Jogja edisi Sabtu 8 Juni 2024. #tapera #putusanma #iduladha https://t.co/NNhsVNuhOl","1799286887393481158","https://pbs.twimg.com/media/GPhZ4XVaYAAsTJN.jpg","","in","Jl Jend Sudirman 52 Yogyakarta","0","0","0","https://x.com/tribunjogja/status/1799286887393481158","223476605","tribunjogja"
"1799695004195266706","Sun Jun 09 06:48:20 +0000 2024","2","Waketum Gerindra Habiburokhman menilai putusan MA soal atas usia calon kepala daerah itu masuk akal. Apa alasannya? #MetroTVKontroversi #jokowidodo #putusanMA #tapera #UKTNaik #pilkada2024 https://t.co/JebtOporl2","1799695004195266706","https://pbs.twimg.com/media/GPnNEIDa0AAEOOs.jpg","","in","","1","1","1","https://x.com/Metro_TV/status/1799695004195266706","57261519","Metro_TV"
"1797882630186336269","Tue Jun 04 06:46:36 +0000 2024","1","Pasca diterbitkannya PP Nomor 21 Tahun 2024 pemerintah akan menambah potongan gaji karyawan buat Tapera atau Tabungan Perumahan Rakyat. Tapera dianggap jadi program pemerintah buat mengatasi kepemilikan rumah di Indonesia. Jendela Data untuk Anda #tapera #komitetapera https://t.co/OmVTKhK7di","1797882630186336269","https://pbs.twimg.com/ext_tw_video_thumb/1797880731697647616/pu/img/wDQcV2xZ4GYX-Osl.jpg","","in","Jakarta - Indonesia","0","0","0","https://x.com/mediaindonesia/status/1797882630186336269","68930552","mediaindonesia"
"1797470935857164775","Mon Jun 03 03:30:41 +0000 2024","456","Sebelum ramai soal pemotongan gaji pekerja untuk tabungan Perumahan Rakyat atau Tapera belakangan ini Badan Pemeriksa Keuangan (BPK) pernah melakukan pemeriksaan terhadap lembaga tersebut pada 2021 lalu. #TempoHeadliner #BPK #Tapera https://t.co/8h0JwAAaiS","1797470935857164775","https://pbs.twimg.com/media/GPHl0R7bkAAvwza.jpg","","in","Indonesia","33","7","289","https://x.com/tempodotco/status/1797470935857164775","18129942","tempodotco"
"1799695647983186039","Sun Jun 09 06:50:53 +0000 2024","15","PDIP mempertanyakan proses hukum gugatan batas usia calon kepala daerah di MA sangat singkat. Apa tujuannya? #MetroTVKontroversi #jokowidodo #putusanMA #tapera #UKTNaik #pilkada2024 https://t.co/BvA0nwXCcx","1799695647983186039","https://pbs.twimg.com/media/GPnNplGb0AAZUxg.jpg","","in","","0","3","8","https://x.com/Metro_TV/status/1799695647983186039","57261519","Metro_TV"
"1797508882052632932","Mon Jun 03 06:01:28 +0000 2024","15","Said Iqbal mendesak pemerintah untuk mencabut dan membatalkan kebijakan Tapera.⁣ ⁣ Ada 6 alasan mengapa kebijakan ini harus ditolak semua buruh atau pekerja. Apa saja? &gt;&gt; https://t.co/lAXkoSluzh ⁣ #detikfinance #Buruh #Tapera https://t.co/bNlUnKmST0","1797508882052632932","https://pbs.twimg.com/media/GPIIxWPaIAAt_kv.jpg","","in","Jakarta, Indonesia","1","1","5","https://x.com/detikfinance/status/1797508882052632932","135795460","detikfinance"
"1797833580103770432","Tue Jun 04 03:31:42 +0000 2024","1","Aturan baru soal potongan gaji pekerja untuk Tabungan Perumahan Rakyat (Tapera) menuai kontroversi di masyarakat. Aturan itu tercantum dalam Peraturan Pemerintah (PP) Nomor 21 Tahun 2024 yang telah diteken oleh Presiden Jokowi. | #Tapera #Jokowi https://t.co/6z8pUwbLbF","1797833580103770432","https://pbs.twimg.com/media/GPMwBlIaYAADeKC.jpg","","in","Jakarta","0","1","0","https://x.com/kompascom/status/1797833580103770432","23343960","kompascom"
"1800875227473408171","Wed Jun 12 12:58:07 +0000 2024","7","Kamu setuju nggak kalau diwajibkan ikut iuran Tapera? Simak diskusi selengkapnya dalam program Dialektika tvMu Tapera: Prahara Bagi Pekerja di Youtube tvMu Channel #Tapera #Muhammadiyah #tvMuhammadiyah #CerdasMencerahkan https://t.co/zi96dtG0Ej","1800875227473408171","https://pbs.twimg.com/ext_tw_video_thumb/1800875175753510912/pu/img/gc-rWIen0r7iCqYU.jpg","","in","Jakarta Capital Region","0","2","1","https://x.com/TVMuhammadiyah/status/1800875227473408171","1915742712","TVMuhammadiyah"
"1798248613673574401","Wed Jun 05 07:00:54 +0000 2024","4","Wah kang @solehsolihun juga ikut membagikan keresahannya soal kebijakan tapera nih Sobat PR kira-kira Sobat PR setuju nggak sama pandangan kang soleh soal tapera? #tapera #jokowi #solehsolihun #PRMN https://t.co/WntGyOLjPx","1798248613673574401","https://pbs.twimg.com/ext_tw_video_thumb/1798246910912020480/pu/img/SaShG9R13ZDLn1b6.jpg","","in","Indonesia","0","0","0","https://x.com/pikiran_rakyat/status/1798248613673574401","58880688","pikiran_rakyat"
"1798690837192401264","Thu Jun 06 12:18:08 +0000 2024","3","BP Tapera buka-bukaan terkait tabungan perumahan pensiunan PNS atau ahli warisnya yang cair hanya sedikit meski sudah nabung puluhan tahun. Dalam kasus yang beredar sudah nabung 30 tahun hanya mendapat Rp 5-6 juta.⁣ &gt;&gt; https://t.co/NiooNcBrkW #detikfinance #PNS #Tapera https://t.co/fA4uk2D8YD","1798690837192401264","https://pbs.twimg.com/media/GPY4tRVbcAArA30.jpg","","in","Jakarta, Indonesia","0","0","1","https://x.com/detikfinance/status/1798690837192401264","135795460","detikfinance"
"1798628887771185562","Thu Jun 06 08:11:58 +0000 2024","2","Buruh di Yogyakarta Demo Tolak Tapera Sebut Tabungan Penderitaan Rakyat ~N #Buruh #Yogyakarta #Demo #Tapera https://t.co/7ns4tQgKBr","1798628887771185562","https://pbs.twimg.com/media/GPYDSkmawAAcnp-.jpg","","in","Jakarta","1","0","2","https://x.com/kompascom/status/1798628887771185562","23343960","kompascom"
"1798696680587743624","Thu Jun 06 12:41:21 +0000 2024","19","Menteri Pertahanan sekaligus presiden terpilih Prabowo Subianto buka suara soal polemik program Tabungan Perumahan Rakyat (Tapera) yang memotong gaji pegawai. Prabowo mengatakan dirinya akan mempelajari dan mencari solusi terbaik. #prabowo #gibran #prabowogibran #tapera https://t.co/qADgzzMDZf","1798696680587743624","https://pbs.twimg.com/ext_tw_video_thumb/1798696554376929281/pu/img/F50B1dY-LruLGMik.jpg","","in","DKI Jakarta, Indonesia","0","4","6","https://x.com/dekade_08/status/1798696680587743624","1576913175227748352","dekade_08"
"1799335557891563919","Sat Jun 08 07:00:01 +0000 2024","16","Saksikan Dialektika tvMu TAPERA : Prahara Bagi Pekerja Sabtu 8 Juni 2024 19.30 WIB Dapat disaksikan melalui siaran digital atau streaming di YouTube tvMu Channel https://t.co/3W0BospZyB #Tapera #Rakyat #Pekerja #Muhammadiyah #tvMuhammadiyah https://t.co/DBCTGJYXDk","1799335557891563919","https://pbs.twimg.com/media/GPiGJb4agAA7b8j.jpg","","in","Jakarta Capital Region","0","1","3","https://x.com/TVMuhammadiyah/status/1799335557891563919","1915742712","TVMuhammadiyah"
"1798368653026677209","Wed Jun 05 14:57:53 +0000 2024","5","Pekerja tolak ikut Tapera. Gaji dipotong iuran rumah belum tentu dapat. Tapi kok pemerintah ngotot sih memaksakan program Tapera untuk pekerja swasta? #Tapera #tabunganperumahanrakyat #pekerja https://t.co/ggDZuci0IA","1798368653026677209","https://pbs.twimg.com/ext_tw_video_thumb/1798368146593861633/pu/img/zhHRRwAD0HRGvFd9.jpg","","in","Jakarta, Indonesia","0","1","6","https://x.com/republikaonline/status/1798368653026677209","22126902","republikaonline"
"1798251015495708959","Wed Jun 05 07:10:26 +0000 2024","2","Badan Pengelola Tapera menyatakan telah mengembalikan Tapera kepada 956.799 orang PNS pensiun atau ahli warisnya senilai Rp 4 2 triliun. Nilai itu merupakan total akumulasi sejak beroperasi hingga 2024.⁣ ⁣ https://t.co/iM6funjxVN #detikfinance #Tapera #BPTapera https://t.co/K7sbwyO9Al","1798251015495708959","https://pbs.twimg.com/media/GPSrvHza0AAV_vv.jpg","","in","Jakarta, Indonesia","0","2","2","https://x.com/detikfinance/status/1798251015495708959","135795460","detikfinance"
"1797954290625265911","Tue Jun 04 11:31:21 +0000 2024","8","Teve forró na #Tapera viu?! Fui comemorar os 20 anos do Bar de Gorete e como um bom nordestino e feirense que sou não desperdicei a oportunidade de dançar aquele forrozinho... Vamos arrastar o pé que São João tá na porta minha gente! #ZéNeto https://t.co/Dm35wHF79P","1797954290625265911","https://pbs.twimg.com/ext_tw_video_thumb/1797954232399638528/pu/img/RQxAcM10qwzujUV-.jpg","","pt","Bahia - Brasil","0","1","3","https://x.com/zenetofeira/status/1797954290625265911","62664968","zenetofeira"
"1798681392483815840","Thu Jun 06 11:40:36 +0000 2024","0","FSPMI Jawa Tengah melakukan aksi demonstrasi di depan kantor gubernuran menolak program Tabungan Perumahan Rakyat (Tapera) Kamis (6/6). https://t.co/TnaDiE3RtF #suaramerdeka #suaramerdekacom #promedia #buruh #semarang #demonstrasi #demo #tolaktapera #tapera #memberatkan https://t.co/pSjEtmjLHz","1798681392483815840","https://pbs.twimg.com/media/GPYzBMua0AAoWwA.jpg","","in","indonesia","0","0","0","https://x.com/suaramerdeka/status/1798681392483815840","219527452","suaramerdeka"
"1797931194048282871","Tue Jun 04 09:59:35 +0000 2024","2","Mampukah pemerintah Indonesia menawarkan rumah layak huni melalui program Tabungan Perumahan Rakyat (TAPERA)? Apa saja hal yang perlu diperhatikan? Peneliti CSIS - Adinova Fauri angkat bicara dan memberikan pandangannya terkait program ini. #CSISIndonesia #Tapera #SisiPeneliti https://t.co/Y9mu5dr62Q","1797931194048282871","https://pbs.twimg.com/ext_tw_video_thumb/1797931138356240384/pu/img/UcaQ1d8XtGzIBxDh.jpg","","in","Jakarta","0","0","3","https://x.com/CSISIndonesia/status/1797931194048282871","1445394860","CSISIndonesia"
"1796950458193547362","Sat Jun 01 17:02:29 +0000 2024","8","akun gue kalau ikutan disuspen sama elon kalian harus paham ya alasannya itu karena #tapera ","1796950458193547362","","","in","","0","0","2","https://x.com/tsetiady/status/1796950458193547362","67281504","tsetiady"
"1797509197674012964","Mon Jun 03 06:02:43 +0000 2024","0","Komisioner BP Tapera Heru Pudyo Nugroho menyatakan bahwa meskipun karyawan sudah memiliki rumah mereka tetap diwajibkan berkontribusi untuk membantu rekan-rekan kerja yang belum memiliki rumah. #tapera https://t.co/s5EwuyQtNd","1797509197674012964","","","in","Jakarta","0","0","0","https://x.com/indozonemedia/status/1797509197674012964","350668803","indozonemedia"
"1800004962602369244","Mon Jun 10 03:20:00 +0000 2024","0","Pemerintah diminta hilangkan niat mengambil uang rakyat melalui pemotongan gaji untuk iuran Tabungan Perumahan Rakyat (Tapera). Kebijakan itu dinilai tak menyejahterakan rakyat. #Tapera #MedcomId https://t.co/LuLvhNtW02","1800004962602369244","","","in","Jakarta Capital Region, Indone","0","0","0","https://x.com/medcom_id/status/1800004962602369244","902837643024539651","medcom_id"
"1797926265426493883","Tue Jun 04 09:40:00 +0000 2024","0","Kepala Staf Kepresidenan RI (KSP) Moeldoko membeberkan bahwa Tapera merupakan tabungan dan diwajibkan dalam undang-undang (UU). #Sanksi #Tapera #MedcomId https://t.co/IEOzjXBv89","1797926265426493883","","","in","Jakarta Capital Region, Indone","0","0","0","https://x.com/medcom_id/status/1797926265426493883","902837643024539651","medcom_id"
"1798720257835880841","Thu Jun 06 14:15:02 +0000 2024","0","Menteri PUPR Basuki Hadimuljono Buka Peluang Menunda Penerapan Iuran Tapera https://t.co/q5jTpknFqP #Tapera","1798720257835880841","","","in","Jakarta, Indonesia","0","0","0","https://x.com/KontanNews/status/1798720257835880841","43799886","KontanNews"
"1797161225500913670","Sun Jun 02 07:00:00 +0000 2024","0","Kelompok buruh menyatakan menolak program Tabungan Perumahan Rakyat (Tapera). Sebab pemerintah tidak menjamin pekerja mendapatkan hunian usai menabung. #Buruh #Tapera #MedcomId https://t.co/mdRfIMC9WD","1797161225500913670","","","in","Jakarta Capital Region, Indone","0","0","0","https://x.com/medcom_id/status/1797161225500913670","902837643024539651","medcom_id"
"1798314185308455223","Wed Jun 05 11:21:27 +0000 2024","1","Pemerintah berkukuh melanjutkan program Tabungan Perumahan Rakyat (#Tapera) meski program itu menuai protes dari banyak pihak. Udah tahu soal Tapera? Atau malah belum tahu? Di artikel ini kami bagikan hak &amp; kewajiban peserta serta sumber dana tapera. https://t.co/e3In07PHMX","1798314185308455223","","","in","Jakarta, Indonesia","0","0","1","https://x.com/beritaKBR/status/1798314185308455223","124390203","beritaKBR"
"1801212792525209617","Thu Jun 13 11:19:29 +0000 2024","0","6 Tuntutan HMI Saat Berunjuk Rasa di Gedung DPRD Balikpapan https://t.co/kan6ELRBQJ #TaperauntukRumah #Tapera #Balikpapan #IKNnusantara #IbuKotaNusantara #IbuKotaNegara #KalimantanTimur #updateinfo #HMI #mahasiswa","1801212792525209617","","","in","Balikpapan, Indonesia","0","0","0","https://x.com/tribunkaltim/status/1801212792525209617","103551225","tribunkaltim"
"1800075823652745245","Mon Jun 10 08:01:34 +0000 2024","0","Pengusaha Jakarta menilai Tapera menambah beban pemberi kerja dan pekerja di sektor swasta. Simak pembahasannya: #Tapera https://t.co/FQZgxmrJxE","1800075823652745245","","","in","Jakarta, Indonesia","0","0","0","https://x.com/detikfinance/status/1800075823652745245","135795460","detikfinance"
"1798648527045656877","Thu Jun 06 09:30:00 +0000 2024","0","Julukan 'penabung mulia' yang disematkan kepada peserta Tapera malah jadi bahan olok-olokan dan sindiran warganet di media sosial. #Warganet #Tapera #MedcomId https://t.co/9OJbj40jLH","1798648527045656877","","","in","Jakarta Capital Region, Indone","0","0","0","https://x.com/medcom_id/status/1798648527045656877","902837643024539651","medcom_id"
